{
  "$schema": "../../schemas/owasp-checklist.schema.json",
  "title": "OWASP Secure Coding Practices Checklist",
  "source": "https://owasp.org/www-project-secure-coding-practices-quick-reference-guide/stable-en/02-checklist/05-checklist",
  "repository": "https://github.com/OWASP/www-project-secure-coding-practices-quick-reference-guide",
  "version": "stable-en",
  "sectionCount": 26,
  "itemCount": 327,
  "sections": [
    {
      "id": "input-validation",
      "title": "Input validation",
      "items": [
        "Conduct all input validation on a trusted system (server side not client side). Do not rely only on client-side validation because it can be bypassed.",
        "Identify all data sources and classify them into trusted and untrusted",
        "Validate all data from untrusted sources (databases, file streams, etc)",
        "Use a centralized input validation routine for the whole application",
        "Specify character sets, such as UTF-8, for all input sources (canonicalization)",
        "Encode input to a common character set before validating",
        "All validation failures should result in input rejection",
        "If the system supports UTF-8 extended character sets and validate after UTF-8 decoding is completed",
        "Validate all client provided data before processing",
        "Verify that protocol header values in both requests and responses contain only ASCII characters",
        "Validate data from redirects",
        "Validate for expected data types using an \"allow\" list rather than a \"deny\" list",
        "Validate data range",
        "Validate data length",
        "If any potentially hazardous input must be allowed then implement additional controls",
        "If the standard validation routine cannot address some inputs then use extra discrete checks",
        "Utilize canonicalization to address obfuscation attacks",
        "Validate application input according to expected field requirements. Ensure input validation covers data type, allowed characters, min/max length, nullability, required fields, duplicates, numeric ranges, enumerations, and patterns.",
        "Validate all user-controlled request values. Review headers, cookies, query strings, form fields, hidden fields, and parameters for proper validation.",
        "Validate and sanitize input for unavoidable external calls. Apply strict allowlisting, length limits, encoding, escaping, and safe argument separation."
      ]
    },
    {
      "id": "output-encoding",
      "title": "Output encoding",
      "items": [
        "Conduct all output encoding on a trusted system (server side not client side). Ensure user-controlled values are encoded before being rendered so injected scripts cannot execute.",
        "Utilize a standard, tested routine for each type of outbound encoding",
        "Specify character sets, such as UTF-8, for all outputs",
        "Contextually output encode all data returned to the client from untrusted sources. Ensure output is validated or encoded before rendering or returning to users to prevent unsafe processing and XSS.",
        "Ensure the output encoding is safe for all target systems",
        "Contextually sanitize all output of un-trusted data to queries for SQL, XML, and LDAP",
        "Sanitize all output of untrusted data to operating system commands"
      ]
    },
    {
      "id": "authentication-and-password-management",
      "title": "Authentication and password management",
      "items": [
        "Require authentication for all pages and resources, except those",
        "All authentication controls must be enforced on a trusted system",
        "Establish and utilize standard, tested, authentication services whenever possible",
        "Use a centralized implementation for all authentication controls,",
        "Segregate authentication logic from the resource being requested and",
        "All authentication controls should fail securely",
        "All administrative and account management functions must be at least",
        "If your application manages a credential store, use cryptographically strong one-way salted hashes. Prefer secure password hashing; do not store plaintext passwords.",
        "Password hashing must be implemented on a trusted system server side not client side)",
        "Validate the authentication data only on completion of all data input",
        "Authentication failure responses should not indicate which part of the authentication data was incorrect. Use generic messages such as login failure instead of revealing whether user ID or password is wrong.",
        "Utilize authentication for connections to external systems that involve sensitive information or functions",
        "Authentication credentials for accessing services external to the",
        "Use only HTTP POST requests to transmit authentication credentials. Ensure authentication and session data are not transmitted in URLs; use safe request methods and secure headers.",
        "Only send non-temporary passwords over an encrypted connection or as encrypted data. Ensure login and credential exchange use encrypted transport.",
        "Enforce password complexity requirements established by policy or regulation",
        "Enforce password length requirements established by policy or regulation",
        "Password entry should be obscured on the user's screen. Ensure sensitive form fields are not visible in clear text during input.",
        "Enforce account disabling after an established number of invalid login attempts. Ensure brute-force protection exists through lockout, throttling, rate limiting, or equivalent controls.",
        "Password reset and changing operations require the same level of",
        "Password reset questions should support sufficiently random answers",
        "If using email based resets, only send email to a pre-registered",
        "Temporary passwords and links should have a short expiration time",
        "Enforce the changing of temporary passwords on the next use",
        "Notify users when a password reset occurs",
        "Prevent password re-use",
        "Passwords should be at least one day old before they can be changed,",
        "Enforce password changes based on requirements established in policy",
        "Disable \"remember me\" functionality for password fields",
        "The last use (successful or unsuccessful) of a user account should",
        "Implement monitoring to identify attacks against multiple user accounts, utilizing the same password",
        "Change all vendor-supplied default passwords and user IDs or disable the associated accounts",
        "Re-authenticate users prior to performing critical operations",
        "Use Multi-Factor Authentication for highly sensitive or high value transactional accounts",
        "If using third party code for authentication, inspect the code",
        "User credentials must be managed securely. Ensure credentials are protected at rest, in transit, and during processing.",
        "Login activity should be logged. Ensure successful and failed login attempts are logged without exposing passwords or secrets."
      ]
    },
    {
      "id": "session-management",
      "title": "Session management",
      "items": [
        "Use the server or framework's session management controls. The",
        "Session identifier creation must always be done on a trusted system (server side not client side). Use secure transport, strong random session identifiers, rotation on authentication or privilege transition, and avoid user-selected session IDs.",
        "Session management controls should use well vetted algorithms that",
        "Set the domain and path for cookies containing authenticated session",
        "Logout functionality should fully terminate the associated session or connection",
        "Logout functionality should be available from all pages protected by authorization",
        "Establish a session inactivity timeout that is as short as possible,",
        "Disallow persistent logins and enforce periodic session",
        "If a session was established before login, close that session and",
        "Generate a new session identifier on any re-authentication",
        "Do not allow concurrent logins with the same user ID",
        "Do not expose session identifiers in URLs, error messages or logs. Reject session tokens in query strings, paths, referrers, logs, or browser history.",
        "Implement appropriate access controls to protect server side session data",
        "Generate a new session identifier and deactivate the old one periodically",
        "Generate a new session identifier if the connection security changes",
        "Consistently utilize HTTPS rather than switching between HTTP to HTTPS",
        "Supplement standard session management for sensitive server-side",
        "Supplement standard session management for highly sensitive or",
        "Set the \"secure\" attribute for cookies transmitted over an TLS connection",
        "Set cookies with the HttpOnly attribute, unless you specifically",
        "Do not store sensitive data in cookies. Reject storage of credentials, personal data, card data, or other sensitive values in cookies.",
        "Cookies must have an expiration policy. Ensure cookies are configured with appropriate expiration or max-age.",
        "Cookie usage must support user consent where required. Ensure applications obtain consent when storing cookies that require approval.",
        "Sensitive cookie values must be encrypted when cookie storage is unavoidable. Avoid sensitive cookie storage; if unavoidable, encrypt according to approved standards."
      ]
    },
    {
      "id": "access-control",
      "title": "Access control",
      "items": [
        "Use only trusted system objects, e.g. server side session objects,",